{
  "schema_version": "1.0.0",
  "updated_at": "2026-03-30T09:32:32.784098+00:00",
  "source": "Portal da Transparência — API de Dados",
  "source_url": "https://api.portaldatransparencia.gov.br",
  "disclaimer_pt": "Dados extraídos do Portal da Transparência do governo federal. PEP (Pessoas Expostas Politicamente) é uma lista obrigatória por lei. A presença na lista não implica irregularidade.",
  "disclaimer_en": "Data extracted from the Brazilian federal government's Transparency Portal. PEP (Politically Exposed Persons) is a legally mandated registry. Presence on the list does not imply any irregularity.",
  "candidates": {
    "lula": {
      "slug": "lula",
      "full_name": "Luiz Inácio Lula da Silva",
      "pep": {
        "found": false,
        "records": []
      },
      "emendas": {
        "total_count": 0,
        "total_empenhado_brl": 0,
        "total_pago_brl": 0,
        "records": []
      },
      "sancoes": [],
      "collected_at": "2026-03-30T09:31:36.092497+00:00",
      "source": "Portal da Transparência",
      "source_url": "https://portaldatransparencia.gov.br"
    },
    "flavio-bolsonaro": {
      "slug": "flavio-bolsonaro",
      "full_name": "Flávio Nantes Bolsonaro",
      "pep": {
        "found": false,
        "records": []
      },
      "emendas": {
        "total_count": 0,
        "total_empenhado_brl": 0,
        "total_pago_brl": 0,
        "records": []
      },
      "sancoes": [],
      "collected_at": "2026-03-30T09:31:46.579380+00:00",
      "source": "Portal da Transparência",
      "source_url": "https://portaldatransparencia.gov.br"
    },
    "tarcisio": {
      "slug": "tarcisio",
      "full_name": "Tarcísio Gomes de Freitas",
      "pep": {
        "found": false,
        "records": []
      },
      "emendas": {
        "total_count": 0,
        "total_empenhado_brl": 0,
        "total_pago_brl": 0,
        "records": []
      },
      "sancoes": [],
      "collected_at": "2026-03-30T09:31:51.787972+00:00",
      "source": "Portal da Transparência",
      "source_url": "https://portaldatransparencia.gov.br"
    },
    "caiado": {
      "slug": "caiado",
      "full_name": "Ronaldo Ramos Caiado",
      "pep": {
        "found": false,
        "records": []
      },
      "emendas": {
        "total_count": 0,
        "total_empenhado_brl": 0,
        "total_pago_brl": 0,
        "records": []
      },
      "sancoes": [],
      "collected_at": "2026-03-30T09:31:56.741700+00:00",
      "source": "Portal da Transparência",
      "source_url": "https://portaldatransparencia.gov.br"
    },
    "zema": {
      "slug": "zema",
      "full_name": "Romeu Zema Neto",
      "pep": {
        "found": false,
        "records": []
      },
      "emendas": {
        "total_count": 0,
        "total_empenhado_brl": 0,
        "total_pago_brl": 0,
        "records": []
      },
      "sancoes": [],
      "collected_at": "2026-03-30T09:32:02.062929+00:00",
      "source": "Portal da Transparência",
      "source_url": "https://portaldatransparencia.gov.br"
    },
    "ratinho-jr": {
      "slug": "ratinho-jr",
      "full_name": "Carlos Roberto Massa Júnior",
      "pep": {
        "found": false,
        "records": []
      },
      "emendas": {
        "total_count": 0,
        "total_empenhado_brl": 0,
        "total_pago_brl": 0,
        "records": []
      },
      "sancoes": [],
      "collected_at": "2026-03-30T09:32:07.233854+00:00",
      "source": "Portal da Transparência",
      "source_url": "https://portaldatransparencia.gov.br"
    },
    "eduardo-leite": {
      "slug": "eduardo-leite",
      "full_name": "Eduardo Figueiredo Cavalheiro Leite",
      "pep": {
        "found": false,
        "records": []
      },
      "emendas": {
        "total_count": 0,
        "total_empenhado_brl": 0,
        "total_pago_brl": 0,
        "records": []
      },
      "sancoes": [],
      "collected_at": "2026-03-30T09:32:11.743227+00:00",
      "source": "Portal da Transparência",
      "source_url": "https://portaldatransparencia.gov.br"
    },
    "aldo-rebelo": {
      "slug": "aldo-rebelo",
      "full_name": "Aldo Rebelo Figueiredo",
      "pep": {
        "found": false,
        "records": []
      },
      "emendas": {
        "total_count": 0,
        "total_empenhado_brl": 0,
        "total_pago_brl": 0,
        "records": []
      },
      "sancoes": [],
      "collected_at": "2026-03-30T09:32:22.110003+00:00",
      "source": "Portal da Transparência",
      "source_url": "https://portaldatransparencia.gov.br"
    },
    "renan-santos": {
      "slug": "renan-santos",
      "full_name": "Renan Franco Santos",
      "pep": {
        "found": false,
        "records": []
      },
      "emendas": {
        "total_count": 0,
        "total_empenhado_brl": 0,
        "total_pago_brl": 0,
        "records": []
      },
      "sancoes": [],
      "collected_at": "2026-03-30T09:32:32.784068+00:00",
      "source": "Portal da Transparência",
      "source_url": "https://portaldatransparencia.gov.br"
    }
  }
}